{
  "framework": "levels-of-interoperability",
  "version": "0.1.0",
  "lastUpdated": "2026-05-22",
  "entries": [
    {
      "id": "R01",
      "order": 10,
      "name": "Personal notebooks and working notes",
      "description": "Informal records of observations, decisions, and working thoughts.",
      "typicalForm": "Paper notebooks, digital notes, loose files.",
      "commonlyPresent": "almost-always",
      "realisticCeiling": "T02 to T03 for most content, occasionally T04a if transcribed and structured.",
      "realisticCeilingLevels": ["T02", "T03", "T04a"],
      "scopeNotes": "Often individual scope only, may never become institutional.",
      "accessibilityNotes": "Often retained personally, accessibility highly variable.",
      "licensingNotes": "Licensing rarely considered. May be inherited from institutional research outputs policies when transcribed or deposited."
    },
    {
      "id": "R02",
      "order": 20,
      "name": "Correspondence and communications",
      "description": "Emails, letters, meeting notes, chat logs.",
      "typicalForm": "Email archives, document files.",
      "commonlyPresent": "almost-always",
      "realisticCeiling": "T02 to T03, rarely higher, due to privacy and selective documentation.",
      "realisticCeilingLevels": ["T02", "T03"],
      "scopeNotes": "Mix of individual and institutional scope.",
      "accessibilityNotes": "Privacy considerations limit accessibility.",
      "licensingNotes": "Privacy and data protection considerations typically dominate. Re-use licensing rarely meaningful as a standalone question."
    },
    {
      "id": "R03",
      "order": 30,
      "name": "Publications and reports",
      "description": "Formal outputs, both own and referenced.",
      "typicalForm": "PDFs, journal articles, grey literature.",
      "commonlyPresent": "usually",
      "realisticCeiling": "T06 (DOIs) routinely, T08a or T08b for open-access publications in repositories.",
      "realisticCeilingLevels": ["T06", "T08a", "T08b"],
      "scopeNotes": "Institutional or public scope.",
      "accessibilityNotes": "Open access trajectory increasingly standard.",
      "licensingNotes": "Open access publications typically carry Creative Commons licences. Traditional publications often have restrictive publisher licences that limit re-use."
    },
    {
      "id": "R04",
      "order": 40,
      "name": "Project documentation",
      "description": "Proposals, methodology documents, ethics approvals, permissions.",
      "typicalForm": "Documents, forms.",
      "commonlyPresent": "usually",
      "realisticCeiling": "T03 to T04b, sometimes T06 if deposited.",
      "realisticCeilingLevels": ["T03", "T04b", "T06"],
      "scopeNotes": "Project to institutional scope.",
      "accessibilityNotes": "Often access-restricted by funder or ethics requirements.",
      "licensingNotes": "Ethics and permissions documents typically have inherent re-use restrictions. Methodology documents increasingly published openly when deposited."
    },
    {
      "id": "R05",
      "order": 50,
      "name": "Raw data files",
      "description": "Direct outputs from instruments and measurements.",
      "typicalForm": "Spectra, image stacks, instrument logs, binary files.",
      "commonlyPresent": "variable",
      "realisticCeiling": "T06+ achievable with appropriate repositories, T08a/T08b through domain repositories.",
      "realisticCeilingLevels": ["T06", "T06+", "T08a", "T08b"],
      "scopeNotes": "Project to international scope.",
      "accessibilityNotes": "Volume and format may complicate access, repositories increasingly available.",
      "licensingNotes": "Re-use licensing key for FAIR compliance. Domain repositories typically require explicit licensing at deposit."
    },
    {
      "id": "R06",
      "order": 60,
      "name": "Processed data and derived products",
      "description": "Calibrated, segmented, or statistically treated data.",
      "typicalForm": "Processed files, analysis outputs.",
      "commonlyPresent": "variable",
      "realisticCeiling": "T06+ to T08a, T08b with appropriate semantic representation.",
      "realisticCeilingLevels": ["T06+", "T08a", "T08b"],
      "scopeNotes": "Project to international scope.",
      "accessibilityNotes": "Often more accessible than raw data due to smaller size.",
      "licensingNotes": "Re-use licensing key for FAIR compliance. May inherit constraints from raw data licensing."
    },
    {
      "id": "R07",
      "order": 70,
      "name": "Images",
      "description": "Technical, documentary, microscopy, instrument imaging.",
      "typicalForm": "Image files, image stacks, IIIF presentations.",
      "commonlyPresent": "usually",
      "realisticCeiling": "T06 to T08b, IIIF infrastructure supports federation directly.",
      "realisticCeilingLevels": ["T06", "T07b", "T08a", "T08b"],
      "scopeNotes": "Institutional to international scope.",
      "accessibilityNotes": "IIIF and similar standards enable broad accessibility.",
      "licensingNotes": "Image licensing varies widely. Institutional images often carry restrictions related to depicted objects. IIIF supports rights statements at the image level."
    },
    {
      "id": "R08",
      "order": 80,
      "name": "Physical samples and references",
      "description": "Material samples and reference materials.",
      "typicalForm": "Physical objects in storage.",
      "commonlyPresent": "variable",
      "realisticCeiling": "T06 through IGSNs and sample registries, T08a as metadata-level federation, semantic layer through T07b/T08b.",
      "realisticCeilingLevels": ["T06", "T07b", "T08a", "T08b"],
      "scopeNotes": "Institutional scope for the physical object, international for the identifier and metadata.",
      "accessibilityNotes": "Physical access always restricted, but discoverability can be global.",
      "licensingNotes": "Re-use licensing applies to the metadata about the sample. Physical sample access governed by separate policies and material transfer agreements."
    },
    {
      "id": "R09",
      "order": 90,
      "name": "Equipment and method records",
      "description": "Records of instruments, parameters, calibration.",
      "typicalForm": "Logs, parameter files, method documents.",
      "commonlyPresent": "variable",
      "realisticCeiling": "T04b through method standards, T06 if instruments are registered, T07b with recommended implementations.",
      "realisticCeilingLevels": ["T04b", "T06", "T07b"],
      "scopeNotes": "Project to international scope.",
      "accessibilityNotes": "Often available but inconsistently documented.",
      "licensingNotes": "Method documentation typically published openly when separated from project-specific details."
    },
    {
      "id": "R10",
      "order": 100,
      "name": "References to objects studied",
      "description": "The heritage objects the research concerns.",
      "typicalForm": "Identifiers, descriptions, links.",
      "commonlyPresent": "usually",
      "realisticCeiling": "T06 through institutional identifiers and PIDs, T08b through linked data publication.",
      "realisticCeilingLevels": ["T06", "T07b", "T08a", "T08b"],
      "scopeNotes": "Institutional to international scope.",
      "accessibilityNotes": "Often the most openly accessible resource type in heritage contexts.",
      "licensingNotes": "Object metadata licensing varies. Aggregators typically require open licences for object descriptions. Imagery of objects may have separate licensing."
    },
    {
      "id": "R11",
      "order": 110,
      "name": "References to people involved",
      "description": "Researchers, conservators, owners, collaborators.",
      "typicalForm": "Names, affiliations, roles.",
      "commonlyPresent": "usually",
      "realisticCeiling": "T06 through ORCID, T07b/T08b through CIDOC CRM actor modelling.",
      "realisticCeilingLevels": ["T06", "T07b", "T08b"],
      "scopeNotes": "Individual to international scope.",
      "accessibilityNotes": "ORCID adoption increasingly standard for researchers.",
      "licensingNotes": "Personal data considerations dominate over re-use licensing. ORCID and similar carry their own data use policies."
    },
    {
      "id": "R12",
      "order": 120,
      "name": "References to organisations",
      "description": "Institutions, funders, custodians, infrastructures.",
      "typicalForm": "Names, identifiers, roles.",
      "commonlyPresent": "usually",
      "realisticCeiling": "T06 through ROR, T07b/T08b through CIDOC CRM modelling.",
      "realisticCeilingLevels": ["T06", "T07b", "T08b"],
      "scopeNotes": "Institutional to international scope.",
      "accessibilityNotes": "ROR and similar registries support easy federation.",
      "licensingNotes": "ROR and similar organisation registries are openly licensed and freely usable."
    },
    {
      "id": "R13",
      "order": 130,
      "name": "Vocabulary and terminology used",
      "description": "Project-specific terms, controlled vocabularies, abbreviations.",
      "typicalForm": "Glossaries, term lists, ad hoc usage.",
      "commonlyPresent": "variable",
      "realisticCeiling": "T05 by definition once externalised, T08b through linked vocabularies.",
      "realisticCeilingLevels": ["T05", "T08b"],
      "scopeNotes": "Project to international scope.",
      "accessibilityNotes": "Often implicit, becomes a resource when documented.",
      "licensingNotes": "Local vocabularies should carry explicit licences when published. Reference to external vocabularies inherits their licensing."
    },
    {
      "id": "R14",
      "order": 140,
      "name": "Provenance and process records",
      "description": "How the work was done, in what order, with what decisions.",
      "typicalForm": "Workflow records, logs, version histories.",
      "commonlyPresent": "variable",
      "realisticCeiling": "T07b/T08b through CRMdig and similar.",